show_id;type;title;director;cast;country;date_added;release_year;rating;duration;listed_in;description;IMDB_titleID;IMDB_rating;IMDB_rating_votes;IMDB_title_name
70297962;Movie;Alpha and Omega 2: A Howl-iday Adventure;Richard Rich;Ben Diskin, Kate Higgins, Blackie Rose, Lindsay Torrance, Liza West, Tracy Pfau, Bill Lader, Meryl Leigh, Shaun Gerardo;United States;2019-10-01;2013;TV-G;45 min;Children & Family Movies;In this animated outdoor adventure, wolf couple Humphrey and Kate face a crisis when one of their three cubs disappears without explanation.;/title/tt3111728/;5.1;849; Alpha and Omega 2: A Howl-iday Adventure
269880;Movie;Bad Boys;Michael Bay;Will Smith, Martin Lawrence, Téa Leoni, Tchéky Karyo, Theresa Randle, Joe Pantoliano, Emmanuel Xuereb, Michael Imperioli, Nestor Serrano, Julio Oscar Mechoso;United States;2019-10-01;1995;R;119 min;Action & Adventure, Comedies;In this fast-paced actioner, two Miami narcotics cops are hot on the trail of a master crook who has snatched $100 million worth of heroin.;/title/tt0112442/;6.9;219652; Bad Boys
60029167;Movie;Bad Boys II;Michael Bay;Will Smith, Martin Lawrence, Jordi Mollà, Gabrielle Union, Peter Stormare, Theresa Randle, Joe Pantoliano, Michael Shannon, Jon Seda, Yul Vazquez;United States;2019-10-01;2003;R;147 min;Action & Adventure, Comedies;In this hyperkinetic sequel, a pair of Miami narcotics cops investigate a Cuban drug kingpin's connection to Florida's influx of Ecstasy.;/title/tt0172156/;6.6;21575; Bad Boys II
60020891;Movie;Blow;Ted Demme;Johnny Depp, Penélope Cruz, Franka Potente, Rachel Griffiths, Paul Reubens, Jordi Mollà, Cliff Curtis, Miguel Sandoval, Ethan Suplee, Ray Liotta;United States;2019-10-01;2001;R;123 min;Dramas;Cocaine smuggler George rises from poverty to become one of the biggest drug dealers in America before his eventual downfall.;/title/tt0221027/;7.6;229842; Blow
60027726;Movie;Charlie's Angels: Full Throttle;McG;Cameron Diaz, Drew Barrymore, Lucy Liu, Bernie Mac, Crispin Glover, Justin Theroux, Robert Patrick, Demi Moore, Rodrigo Santoro, Shia LaBeouf, Matt LeBlanc, Luke Wilson, John Cleese;United States;2019-10-01;2003;PG-13;106 min;Action & Adventure, Comedies;In this reboot of the TV classic, the Angels are tasked with finding lost rings encoded with the personal information of people in witness protection.;/title/tt0305357/;4.9;116191; Charlie's Angels: Full Throttle
81166946;TV Show;Cheese in the Trap;Lee Yoon-jung;Park Hae-Jin, Kim Go-eun, Seo Kang-jun, Lee Sung-kyoung, Nam Joo-hyuk, Park Min-ji, Hwang Seog-jeong, Son Byung-ho, Ahn Kil-kang;South Korea;2019-10-01;2016;TV-14;1 Season;International TV Shows, Korean TV Shows, Romantic TV Shows;In this adaptation of a popular webtoon, a poor student trying to navigate college life gains the attention of a wealthy upperclassman with a dark side.;/title/tt4741110/;7.5;2045; Cheese in the Trap
81113888;TV Show;College Romance;;Manjot Singh, Apoorva Arora, Keshav Sadhna, Shreya Mehta, Hira Ashar, Gagan Arora;India;2019-10-01;2018;TV-MA;1 Season;International TV Shows, Romantic TV Shows, TV Comedies;Three best friends look for love, laughs and some lifelong memories while attending college together.;/title/tt8809646/;9.1;19041; College Romance
70023961;Movie;Crash;Paul Haggis;Sandra Bullock, Don Cheadle, Matt Dillon, Jennifer Esposito, William Fichtner, Brendan Fraser, Terrence Howard, Ludacris, Thandie Newton, Ryan Phillippe, Larenz Tate, Nona Gaye, Michael Peña;United States, Germany;2019-10-01;2004;R;112 min;Dramas, Independent Movies;In post-Sept. 11 Los Angeles, tensions erupt when the lives of people from all walks of life converge during a 36-hour period.;/title/tt0375679/;7.8;407242; Crash
60027716;Movie;Dumb and Dumberer: When Harry Met Lloyd;Troy Miller;Eric Christian Olsen, Derek Richardson, Rachel Nichols, Cheri Oteri, Luis Guzmán, Elden Henson, William Lee Scott, Mimi Rogers, Eugene Levy;United States;2019-10-01;2003;PG-13;85 min;Comedies;This wacky prequel to the 1994 blockbuster goes back to the lame-brained title characters' days as classmates at a Rhode Island high school.;/title/tt0329028/;3.4;35895; Dumb and Dumberer: When Harry Met Lloyd
70287957;Movie;Earth to Echo;Dave Green;Teo Halm, Astro, Reese Hartwig, Ella Wahlestedt, Jason Gray-Stanford, Algee Smith, Cassius Willis, Sonya Leslie, Kerry O'Malley, Virginia Louise Smith, Peter Mackenzie, Valerie Wildman;United States;2019-10-01;2014;PG;91 min;Children & Family Movies, Sci-Fi & Fantasy;When a construction project begins in their neighborhood, four friends start receiving bizarre encoded text messages on their cell phones.;/title/tt2183034/;5.8;17894; Earth to Echo
81113890;TV Show;Engineering Girls;;Barkha Singh, Kritika Avasthi, Sejal Kumar;India;2019-10-01;2018;TV-14;1 Season;International TV Shows, TV Comedies;Three engineering students deal with dorm drama, date around, and do whatever it takes to make their dreams come true.;/title/tt8502324/;6.9;767; Engineering Girls
60020892;Movie;Exit Wounds;Andrzej Bartkowiak;Steven Seagal, DMX, Isaiah Washington, Anthony Anderson, Michael Jai White, Bill Duke, Jill Hennessy, Tom Arnold, Bruce McGill, David Vadim, Eva Mendes;United States;2019-10-01;2001;R;101 min;Action & Adventure;Maverick cop Orin Boyd joins forces with an unlikely ally in gangster Latrell Walker to take down a group of dirty Detroit cops.;/title/tt0242445/;5.6;31028; Exit Wounds
81113886;TV Show;Girls Hostel;;Srishti Shrivastava, Parul Gulati, Simran Natekar, Ahsaas Channa, Shreya Mehta, Gagan Arora, Trupti Khamkar, Khushbu Baid;India;2019-10-01;2018;TV-MA;1 Season;International TV Shows, TV Comedies, TV Dramas;Four girls from different backgrounds become unlikely friends when they move into a dormitory for female dental students.;/title/tt9401936/;8.5;235; Girls Hostel
60028097;Movie;Good Burger;Brian Robbins;Kenan Thompson, Kel Mitchell, Abe Vigoda, Dan Schneider, Shar Jackson, Jan Schweiterman, Linda Cardellini, Sinbad, Ron Lester, Josh Server, Ginny Schreiber;United States;2019-10-01;1997;PG;96 min;Children & Family Movies, Comedies;Two L.A. teens with summer jobs at Good Burger try to save their small restaurant when a corporate giant burger franchise moves in across the street.;/title/tt0119215/;5.7;24733; Good Burger
70065112;Movie;Good Luck Chuck;Mark Helfrich;Dane Cook, Jessica Alba, Dan Fogler, Ellia English, Sasha Pieterse, Annie Wood, Lonny Ross, Chelan Simmons, Simone Bailly, Jodelle Ferland, Crystal Lowe, Troy Gentile, Georgia Craig, Michelle Harrison, Chiara Zanni;United States, Canada;2019-10-01;2007;UR;99 min;Comedies, Romantic Movies;Every time Chuck breaks up with a girlfriend, she ends up engaged to her next boyfriend. Soon, women are dating Chuck in hopes of meeting Mr. Right.;/title/tt0452625/;5.6;83174; Good Luck Chuck
70083108;Movie;Harold & Kumar Escape from Guantanamo Bay;Jon Hurwitz, Hayden Schlossberg;John Cho, Kal Penn, Rob Corddry, Jack Conley, Roger Bart, Neil Patrick Harris, Danneel Ackles, Eric Winter, Paula Garcés, Jon Reep, Missi Pyle;United States;2019-10-01;2008;R;101 min;Comedies, Cult Movies;Harold and Kumar jump on a plane to catch up with Harold's love interest but must change their plans when Kumar is accused of being a terrorist.;/title/tt0481536/;6.6;127136; Harold & Kumar Escape from Guantanamo Bay
70184050;Movie;Honey 2;Bille Woodruff;Kat Graham, Mario Lopez, Audrina Patridge, Seychelle Gabriel, Randy Wayne, Brandon Molale, Melissa Molinaro, Jossara Jinaro, Lonette McKee, Laurieann Gibson, Christopher Shazar;United States;2019-10-01;2011;PG-13;111 min;Dramas, Romantic Movies;Determined to prove herself as a street dancer, Maria heads from juvie to a Bronx rec center where she's introduced to her dance idol, Honey Daniels.;/title/tt1657283/;5.3;6603; Honey 2
81003460;Movie;House of the Witch;Alex Merkin;Emily Bader, Darren Mann, Michelle Randolph, Coy Stewart, Jesse Pepe, Arden Belle, Joel Nagle, Nolan Bateman;United States;2019-10-01;2017;TV-14;86 min;Horror Movies;A group of daring teens finds themselves in a fight for their lives inside a haunted house when a sinister spirit crashes their Halloween party.;/title/tt6988208/;4.9;1965; House of the Witch
81113887;TV Show;Inmates;;Kashyap Kapoor, Ashish Verma, Raghav Raj Kakker, Mukti Mohan, Akanksha Thakur;India;2019-10-01;2017;TV-MA;1 Season;International TV Shows, TV Comedies;While living under one roof, five close-knit 20-somethings maneuver the highs and lows of friendship, romantic entanglements and finding themselves.;/title/tt6897680/;6.6;894; InMates
70095135;Movie;Knowing;Alex Proyas;Nicolas Cage, Chandler Canterbury, Rose Byrne, Lara Robinson, D.G. Maloney, Nadia Townsend, Alan Hopgood, Adrienne Pickering;United States, United Kingdom, Australia;2019-10-01;2009;PG-13;121 min;Sci-Fi & Fantasy, Thrillers;An MIT astrophysics professor and his son unearth a string of numbers from a time capsule that seem to reveal a cataclysm that will wipe out humanity.;/title/tt0448011/;6.2;212823; Knowing
60023597;Movie;Men in Black II;Barry Sonnenfeld;Tommy Lee Jones, Will Smith, Rip Torn, Lara Flynn Boyle, Johnny Knoxville, Rosario Dawson, Tony Shalhoub, Patrick Warburton, Jack Kehler, David Cross;United States;2019-10-01;2002;PG-13;88 min;Action & Adventure, Comedies, Sci-Fi & Fantasy;Will Smith and Tommy Lee Jones reprise their roles as two highly secretive and unofficial government agents dealing with all things evil and alien.;/title/tt0120912/;6.2;326578; Men in Black II
70058017;Movie;No Reservations;Scott Hicks;Catherine Zeta-Jones, Aaron Eckhart, Abigail Breslin, Patricia Clarkson, Jenny Wade, Bob Balaban, Brían F. O'Byrne, Lily Rabe;United States;2019-10-01;2007;PG;104 min;Comedies, Romantic Movies;Kate, an uptight chef, finds her life turned upside down when her sister dies in a car accident and she becomes her niece's sole guardian.;/title/tt0481141/;6.3;68033; No Reservations
70058024;Movie;Ocean's Thirteen;Steven Soderbergh;George Clooney, Brad Pitt, Matt Damon, Andy Garcia, Don Cheadle, Bernie Mac, Ellen Barkin, Al Pacino, Casey Affleck, Scott Caan;United States;2019-10-01;2007;PG-13;122 min;Action & Adventure, Comedies;This entry in the all-star caper franchise finds debonair con man Danny Ocean and his gang taking revenge on a double-crossing Las Vegas kingpin.;/title/tt0496806/;6.9;305337; Ocean's Thirteen
70011211;Movie;Ocean's Twelve;Steven Soderbergh;George Clooney, Brad Pitt, Matt Damon, Catherine Zeta-Jones, Andy Garcia, Don Cheadle, Bernie Mac, Julia Roberts, Casey Affleck, Scott Caan;United States;2019-10-01;2004;PG-13;125 min;Action & Adventure, Comedies;Danny Ocean reunites with his old flame and the rest of his merry band of thieves in a caper covering three huge heists in Rome, Paris and Amsterdam.;/title/tt0349903/;6.5;340569; Ocean's Twelve
70271599;Movie;One Direction: This Is Us;Morgan Spurlock;Harry Styles, Niall Horan, Zayn Malik, Louis Tomlinson, Liam Payne;United States;2019-10-01;2013;PG;92 min;Documentaries, Music & Musicals;Award-winning documentarian Morgan Spurlock turns his camera on boy band phenomenon One Direction in this combination concert film and backstage pass.;/title/tt2515086/;4.2;23099; One Direction: This Is Us
70020699;Movie;Raging Bull;Martin Scorsese;Robert De Niro, Cathy Moriarty, Joe Pesci, Frank Vincent, Nicholas Colasanto, Theresa Saldana, Mario Gallo, Frank Adonis, Joseph Bono;United States;2019-10-01;1980;R;129 min;Classic Movies, Dramas, Sports Movies;This gritty biopic of brutal boxer Jake LaMotta portrays a tormented soul rising to the top of his sport, only to be undone by his demons.;/title/tt0081398/;8.2;301203; Raging Bull
60003540;Movie;Rugrats in Paris: The Movie;Stig Bergqvist, Paul Demeyer;Elizabeth Daily, Tara Strong, Cheryl Chase, Christine Cavanaugh, Cree Summer, Kath Soucie, Michael Bell, Tress MacNeille, Casey Kasem, Joe Alaskey, Debbie Reynolds, Jack Riley, Susan Sarandon, John Lithgow;Germany, United States;2019-10-01;2000;G;79 min;Children & Family Movies, Comedies;The Rugrats take to the big screen and visit Paris when Mr. Pickles gets summoned to fix a giant robot at the EuroReptarland theme park.;/title/tt0213203/;6.1;10496; Rugrats in Paris: The Movie
1181550;Movie;Scream 2;Wes Craven;Neve Campbell, David Arquette, Courteney Cox, Sarah Michelle Gellar, Jamie Kennedy, Laurie Metcalf, Elise Neal, Jerry O'Connell, Timothy Olyphant, Jada Pinkett Smith, Liev Schreiber, Lewis Arquette, Duane Martin, Rebecca Gayheart, Portia de Rossi, Omar Epps, Tori Spelling, Heather Graham, Joshua Jackson, Luke Wilson;United States;2019-10-01;1997;R;121 min;Horror Movies;Gale has written a best-seller which has been turned into a film. As the movie premiere looms closer, the mysterious deaths begin again.;/title/tt0120082/;6.2;149297; Scream 2
70170051;Movie;Senna;Asif Kapadia;Ayrton Senna, Alain Prost, Frank Williams;United Kingdom, France, United States;2019-10-01;2010;PG-13;106 min;Documentaries, International Movies, Sports Movies;This fast-paced documentary profiles Ayrton Senna, one of the greatest drivers in the history of Formula One racing, and a hero in his native Brazil.;/title/tt1424432/;8.5;58151; Senna
70021630;Movie;Sin City;Robert Rodriguez, Frank Miller;Bruce Willis, Mickey Rourke, Jessica Alba, Clive Owen, Rosario Dawson, Benicio Del Toro, Nick Stahl, Elijah Wood, Rutger Hauer, Powers Boothe, Devon Aoki, Alexis Bledel, Josh Hartnett, Jaime King, Brittany Murphy, Michael Clarke Duncan, Michael Madsen;United States;2019-10-01;2005;R;124 min;Action & Adventure;In these intertwined tales, an ex-con avenges a hooker's death, a gumshoe gets mixed up with dangerous vixens, and a cop saves a dancer from a rapist.;/title/tt0401792/;8.0;724578; Sin City
70041963;Movie;Superman Returns;Bryan Singer;Brandon Routh, Kate Bosworth, Kevin Spacey, James Marsden, Parker Posey, Frank Langella, Sam Huntington, Eva Marie Saint, Marlon Brando, Kal Penn;United States;2019-10-01;2006;PG-13;154 min;Action & Adventure, Sci-Fi & Fantasy;When Superman returns to Metropolis, he finds that Lois Lane has moved on to another man and Lex Luthor is developing a new plan to rule the world.;/title/tt0348150/;6.0;264452; Superman Returns
70058025;Movie;Surf's Up;Ash Brannon, Chris Buck;Shia LaBeouf, Jeff Bridges, Zooey Deschanel, Jon Heder, James Woods, Diedrich Bader, Mario Cantone, Kelly Slater, Rob Machado, Sal Masekela;United States;2019-10-01;2007;PG;86 min;Children & Family Movies, Comedies, Sports Movies;This Oscar-nominated mockumentary goes behind the scenes at the Penguin World Surfing Championship to get a close-up look at the inventors of surfing.;/title/tt0423294/;6.7;65339; Surf's Up
70128696;Movie;The Bounty Hunter;Andy Tennant;Jennifer Aniston, Gerard Butler, Jason Sudeikis, Jeff Garlin, Ritchie Coster, Cathy Moriarty, Peter Greene, Joel Marsh Garland, Siobhan Fallon Hogan, Dorian Missick, Adam Rose, Christine Baranski, Carol Kane, Adam LeFevre;United States;2019-10-01;2010;PG-13;111 min;Action & Adventure, Comedies, Romantic Movies;Bounty hunter Milo Boyd finds his latest assignment downright satisfying as he learns that the bail-jumper he must chase down is his ex-wife, Nicole.;/title/tt1038919/;5.6;116224; The Bounty Hunter
70077542;Movie;The Bucket List;Rob Reiner;Jack Nicholson, Morgan Freeman, Sean Hayes, Beverly Todd, Alfonso Freeman, Rob Morrow, Rowena King, Christopher Stapleton, Ian Anthony Dale, Richard McGonagle;United States;2019-10-01;2007;PG-13;97 min;Comedies, Dramas;Two terminally ill men bust out of the cancer ward with a plan to experience life to the fullest before they kick the bucket.;/title/tt0825232/;7.4;220207; The Bucket List
510854;Movie;The Flintstones;Brian Levant;John Goodman, Elizabeth Perkins, Rick Moranis, Rosie O'Donnell, Kyle MacLachlan, Halle Berry, Elizabeth Taylor, Dann Florek, Sam Raimi, Harvey Korman;United States;2019-10-01;1994;PG;91 min;Children & Family Movies, Comedies;The Flintstones hit the big screen in this live-action comedy that finds Fred and Barney struggling to cope with the pressures of work and family.;/title/tt0109813/;4.9;72323; The Flintstones
60000921;Movie;The Flintstones in Viva Rock Vegas;Brian Levant;Mark Addy, Stephen Baldwin, Kristen Johnston, Jane Krakowski, Joan Collins, Thomas Gibson, Alan Cumming;United States;2019-10-01;2000;PG;91 min;Children & Family Movies, Comedies, Romantic Movies;Yabba-dabba-doo! Digital dinosaurs rule the day when Fred, Barney, Betty and Wilma take Vegas by storm in this prequel that posits their lives before marriage.;/title/tt0158622/;3.6;20281; The Flintstones in Viva Rock Vegas
80188730;TV Show;The K2;;Ji Chang-wook, Song Yoon-a, Lim Yoona, Cho Seong-ha, Kim Kap-soo, Lee Jung-jin, Son Tae-young, Shin Dong-mi;South Korea;2019-10-01;2016;TV-14;1 Season;International TV Shows, Korean TV Shows, Romantic TV Shows;A fugitive soldier gets swept up in personal and political intrigue when he's hired as a bodyguard for the family of a presidential candidate.;/title/tt5966882/;7.8;2098; The K2
70044605;Movie;The Pursuit of Happyness;Gabriele Muccino;Will Smith, Jaden Smith, Thandie Newton, Brian Howe, James Karen, Dan Castellaneta, Kurt Fuller, Takayo Fischer;United States;2019-10-01;2006;PG-13;117 min;Dramas;When Chris and his son are evicted, they face trying times as a desperate Chris accepts an unpaid internship at a stock brokerage firm.;/title/tt0454921/;8.0;419599; The Pursuit of Happyness
18021979;Movie;The Rugrats Movie;Igor Kovalyov, Norton Virgien;Elizabeth Daily, Christine Cavanaugh, Kath Soucie, Melanie Chartoff, Phil Proctor, Cree Summer, Cheryl Chase, Tara Strong, Jack Riley, Joe Alaskey, Michael Bell, Tress MacNeille, Busta Rhymes, Whoopi Goldberg, David Spade;United States;2019-10-01;1998;G;81 min;Children & Family Movies, Comedies;When his baby brother Dil is born, Tommy Pickles and his pals decide that he's too much responsibility and try to return him to the hospital.;/title/tt0134067/;5.9;1723; The Rugrats Movie
70020750;Movie;The Squid and the Whale;Noah Baumbach;Jeff Daniels, Laura Linney, Jesse Eisenberg, Owen Kline, William Baldwin, Halley Feiffer, Anna Paquin, Ken Leung, David Benger, Adam Rose;United States;2019-10-01;2005;R;81 min;Comedies, Dramas, Independent Movies;This insightful drama looks at the crumbling marriage between a self-centered novelist – whose career is waning – and his up-and-coming writer wife.;/title/tt0367089/;7.3;72369; The Squid and the Whale
70105596;Movie;The Time Traveler's Wife;Robert Schwentke;Rachel McAdams, Eric Bana, Arliss Howard, Ron Livingston, Stephen Tobolowsky, Michelle Nolden, Jane McLean, Hailey McCann, Tatum McCann, Brooklynn Proulx, Alex Ferris;United States;2019-10-01;2009;PG-13;107 min;Dramas, Romantic Movies, Sci-Fi & Fantasy;Due to a genetic disorder, handsome librarian Henry involuntarily zips through time, appearing at various moments in the life of his true love.;/title/tt0452694/;7.1;135529; The Time Traveler's Wife
60037022;Movie;Trainspotting;Danny Boyle;Ewan McGregor, Ewen Bremner, Jonny Lee Miller, Kevin McKidd, Robert Carlyle, Kelly Macdonald, Peter Mullan, James Cosmo, Eileen Nicholas, Susan Vidler, Pauline Lynch, Shirley Henderson;United Kingdom;2019-10-01;1996;R;94 min;Comedies, Cult Movies, Dramas;Renton and his mates cope with the gritty realities of heroin addiction. But when Renton gets clean, he can't get away from his friends' nasty habits.;/title/tt0117951/;8.1;606644; Trainspotting
60034571;Movie;Troy;Wolfgang Petersen;Brad Pitt, Eric Bana, Orlando Bloom, Diane Kruger, Peter O'Toole, Rose Byrne, Sean Bean, Brian Cox, Julie Christie, Saffron Burrows;United States, Malta, United Kingdom;2019-10-01;2004;R;163 min;Action & Adventure, Dramas;The love-struck Prince Paris of Troy kidnaps beauty Helen from her husband, setting the two nations on a collision course for war.;/title/tt0332452/;7.2;465743; Troy
70053456;Movie;Unaccompanied Minors;Paul Feig;Lewis Black, Wilmer Valderrama, Tyler James Williams, Gia Mantegna, Dyllan Christopher, Brett Kelly, Quinn Shephard, Paget Brewster, Rob Corddry, Dominique Saldaña;United States;2019-10-01;2006;PG;90 min;Children & Family Movies, Comedies;Five disparate kids, snowed in at the airport on Christmas Eve, try to get back to their families and outsmart a disgruntled airport official.;/title/tt0488658/;5.3;10058; Unaccompanied Minors
80173150;Movie;Walking Out;Alex Smith, Andrew J. Smith;Matt Bomer, Josh Wiggins, Bill Pullman, Alex Neustaedter, Lily Gladstone;United States;2019-10-01;2017;PG-13;96 min;Dramas, Independent Movies, Thrillers;A suburban teen goes hunting with his estranged father. When a mishap with a bear occurs, he must his use his survival skills to save them both.;/title/tt5420886/;5.8;5242; Walking Out
80137461;Movie;25 Kille;Simranjit Singh Hundal;Guggu Gill, Yograj Singh, Sonia Mann, Jimmy Sharma, Sapna Bassi, Lakha Lakhwinder Singh, Sandeep Kaur Sandy, Sardar Sohi;India;2018-10-01;2016;TV-PG;140 min;Action & Adventure, Dramas, International Movies;Four brothers learn that they have inherited ancestral land, but must fight to claim it when a greedy feudal lord threatens to take it over.;/title/tt5743858/;5.9;81; 25 Kille
81012857;Movie;A Witches' Ball;Justin G. Dyck;Morgan Neundorf, Karen Slater, Loukia Ioannou, Will Ennis, Renee Stein, Keith Cooper, Paul Mason, Lisa Scenna, Ashley Rogan;Canada;2018-10-01;2017;PG;91 min;Children & Family Movies;Beatrix can't wait to be inducted as a witch, but an unfortunate incident threatens to take her pending title away if she doesn't act fast.;/title/tt5814408/;5.2;230; A Witches' Ball
70123116;Movie;Agyaat;Ram Gopal Varma;Adesh Bhardwaj, Rasika Dugal, Joy Fernandes, Ravi Kale, Ishtiyak Khan, Priyanka Kothari, Kali Prasad Mukherjee, Nitin Reddy, Gautam Rode, Howard Rosemeyer;India;2018-10-01;2009;TV-MA;97 min;Horror Movies, International Movies;A film crew shooting in a remote forested location begins losing members one by one to a mysterious entity that they cannot see or hear.;/title/tt1415252/;2.8;561; Agyaat
80190101;Movie;Anjaan;N. Linguswamy;Suriya, Samantha Ruth Prabhu, Vidyut Jammwal, Manoj Bajpayee, Soori;India;2018-10-01;2014;TV-MA;146 min;Action & Adventure, Dramas, International Movies;Mild-mannered Krishna comes to Mumbai to search for his gang-leader brother, and quickly finds himself in way over his head.;/title/tt3563156/;4.9;3684; Anjaan
81024712;Movie;Bathinda Express;Deep Joshi;Deep Joshi, Jasmine Kaur, Mohit Bhaskar, Vijay S. Kumar, Prince Kanwaljit Singh, Tarlochan Singh, Harsh Sethi;India;2018-10-01;2016;TV-14;118 min;Dramas, International Movies, Sports Movies;An ambitious young athlete endeavors to revive his floundering running career after falling prey to negative influences.;/title/tt6885956/;6.1;7; Bathinda Express
70112494;Movie;Brooklyn's Finest;Antoine Fuqua;Richard Gere, Don Cheadle, Ethan Hawke, Wesley Snipes, Will Patton, Lili Taylor, Michael Kenneth Williams, Brían F. O'Byrne, Shannon Kane, Ellen Barkin, Vincent D'Onofrio, Logan Marshall-Green;United States;2018-10-01;2009;R;133 min;Dramas, Thrillers;Three cops find themselves hurtling toward the same crime scene on one fatal night in this tense, edge-of your-seat thriller.;/title/tt1210042/;6.7;59113; Brooklyn's Finest
80215922;Movie;Chappaquiddick;John Curran;Jason Clarke, Kate Mara, Ed Helms, Bruce Dern, Jim Gaffigan, Olivia Thirlby, Clancy Brown, Taylor Nichols, John Fiore;United States, Sweden;2018-10-01;2017;PG-13;106 min;Dramas;Senator Ted Kennedy watches his future unravel in the wake of an infamous car crash as family and allies vie to protect his reputation.;/title/tt5270948/;6.5;10501; Chappaquiddick
70113305;Movie;Dev.D;Anurag Kashyap;Abhay Deol, Mahie Gill, Kalki Koechlin, Sindbad Phgura, Ammo 'Too Sweet', Jimi the Quiff, Parakh Madan;India;2018-10-01;2009;TV-MA;137 min;Dramas, International Movies, Romantic Movies;Because they come from different castes, the son of a tax collector and his true love are not allowed to marry, sending them down divergent paths.;/title/tt1327035/;8.0;26967; Dev.D
80032472;Movie;Dil Vil Pyaar Vyaar;Manjeet Maan;Gurdas Maan, Neeru Bajwa, Jassi Gill, Rajiv Thakur, Khushdeed Maan, Manav Vij, Raj Jhinger, Shruti Sodhi, Meher Vij;India;2018-10-01;2014;TV-PG;145 min;International Movies, Music & Musicals, Romantic Movies;Agam Singh's brothers mean everything to him, so while he promises not to marry, he tries to get them to marry – but they want him to marry first.;/title/tt3723864/;6.4;59; Dil Vil Pyaar Vyaar
70181653;Movie;Ek Main Aur Ekk Tu;Shakun Batra;Kareena Kapoor, Imran Khan, Boman Irani, Ram Kapoor, Ratna Pathak Shah, Zenobia Shroff, Soniya Mehra, Akshat Verma, Dana Lewis, Rajesh Khattar;India;2018-10-01;2012;TV-14;106 min;Comedies, International Movies, Romantic Movies;Bollywood stars Imran Khan and Kareena Kapoor pair up to play exceptionally dissimilar lovers in this lighthearted romantic comedy.;/title/tt1703958/;5.8;6126; Ek Main Aur Ekk Tu
80032474;Movie;Haani;Amitoj Mann;Sarabjit Cheema, Mahreen Kaleka, Harbhajan Mann, Anuj Sachdeva, Rupan Bal, Sonia Mann;India;2018-10-01;2013;TV-14;137 min;Dramas, International Movies, Music & Musicals;When a man discovers that he can communicate with his grandfather's spirit, it leads to two love stories intertwining 50 years apart.;/title/tt3211048/;7.1;116; Haani
70127589;Movie;Harishchandrachi Factory;Paresh Mokashi;Nandu Madhav, Vibhawari Deshpande, Ambarish Deshpande, Mohit Gokhale, Dilip Joglekar, Dheeresh Joshi, Ketan Karande, Atharva Karve, Mayur Khandge, Sandip Pathak;India;2018-10-01;2009;TV-PG;99 min;Dramas, International Movies;Against a backdrop of burgeoning social unrest, a neophyte filmmaker makes history in 1913 as the director of India's first feature-length film.;/title/tt1524539/;8.4;1854; Harishchandrachi Factory
