show_id;type;title;director;cast;country;date_added;release_year;rating;duration;listed_in;description;IMDB_titleID;IMDB_rating;IMDB_rating_votes;IMDB_title_name
80161700;TV Show;One More Time;;L, So-hui Yoon, Gi-du Kim, Chang-hwan Kim, Ji Su, Tae-im Lee, Nam-gil Kang;South Korea;2017-03-10;2016;TV-14;1 Season;International TV Shows, Korean TV Shows, Romantic TV Shows;This fantasy drama follows an indie band singer who repeatedly undergoes unwanted time slips and the girlfriend he must save from an unlucky fate.;/title/tt3662066/;5.2;202; One More Time
80134399;Movie;Patron Mutlu Son Istiyor;Kıvanç Baruönü;Tolga Çevik, Ezgi Mola, Murat Başoğlu, Erkan Can, Ersin Korkut, Mustafa Uzunyılmaz, Nusret Çetinel, Ayşenur Yazıcı;Turkey;2017-03-10;2014;TV-MA;105 min;Comedies, International Movies, Romantic Movies;Sent to a remote village to write a screenplay, Sinan finds inspiration to spare in colorful locals, farcical misadventures and the craziness of love.;/title/tt3233224/;6.1;5787; Patron Mutlu Son Istiyor
80134438;Movie;Romantik Komedi;Ketche;Sedef Avcı, Cemal Hünal, Begüm Kütük, Engin Altan Düzyatan, Sinem Kobal, Gürgen Öz, Burcu Kara, Kubilay Penbeklioğlu;Turkey;2017-03-10;2010;NR;110 min;Comedies, International Movies, Romantic Movies;Bored with her life and inspired by a friend's wedding, Esra quits her job and dumps her boyfriend, leading to a series of romantic misadventures.;/title/tt1587263/;5.3;444; Romantik Komedi
80134519;Movie;Sadece Sen;Hakan Yonat;Belçim Bilgin, İbrahim Çelikkol, Kerem Can, Necmi Yapıcı, Levent Sülün, Barış Arduç, Erol Gedik, Cezmi Baskın;Turkey;2017-03-10;2014;TV-MA;105 min;Dramas, International Movies, Romantic Movies;An ex-boxer falls in love with a blind woman and starts to build a new life, but his violent past returns to endanger them both.;/title/tt3477480/;7.4;3501; Sadece Sen
80134434;Movie;Sen Kimsin?;Ozan Açıktan;Tolga Çevik, Köksal Engür, Pelin Körmükçü, Toprak Sergen, Zeynep Özder;Turkey;2017-03-10;2012;TV-14;102 min;Comedies, International Movies;Desperate for cash, klutzy private investigator Tekin searches for a wealthy woman's missing girl but faces one surprise and mishap after another.;/title/tt2142883/;5.1;47; Sen Kimsin?
80038527;Movie;Vizontele;Yılmaz Erdoğan, Ömer Faruk Sorak;Yılmaz Erdoğan, Demet Akbağ, Altan Erkekli, Cem Yılmaz, Cezmi Baskın, Bican Günalan, Sebnem Sönmez, İclal Aydın, Mesut Çakarli, Zeynep Tokuş;Turkey;2017-03-10;2001;NR;106 min;Comedies, Dramas, International Movies;In 1974, a rural town in Anatolia gets its first television set – an event that's met with both excitement and trepidation by the villagers.;/title/tt0270053/;8.0;3019; Vizontele
81059183;Movie;2,215;Nottapon Boonprakob;Artiwara Kongmalai;Thailand;2019-03-01;2018;TV-14;89 min;Documentaries, International Movies, Sports Movies;This intimate documentary follows rock star Artiwara Kongmalai on his historic, 2,215-kilometer charity run across Thailand in 2017.;/title/tt8891536/;7.9;243;2,215
81024332;Movie;An Interview with God;Perry Lang;Brenton Thwaites, David Strathairn, Hill Harper, Charlbi Dean, Yael Grobglas;United States;2019-03-01;2018;TV-PG;97 min;Dramas, Faith & Spirituality;After an assignment in a war zone, a journalist trying to put his life back together is granted an interview with someone claiming to be God.;/title/tt5779372/;5.7;2603; An Interview with God
81059444;Movie;BNK48: Girls Don't Cry;Nawapol Thamrongrattanarit;;Thailand;2019-03-01;2018;TV-PG;108 min;Documentaries, International Movies, Music & Musicals;Members of the Thai idol girl group BNK48 open up about their experiences beyond the spotlight, their training and the nature of fame.;/title/tt8730152/;7.3;554; BNK48: Girls Don't Cry
80987464;Movie;Budapest;Xavier Gens;Manu Payet, Jonathan Cohen, Monsieur Poulpe, Alice Belaïdi, Alix Poisson;France, Belgium;2019-03-01;2018;TV-MA;103 min;Comedies, International Movies;Two best friends put their careers and marriages on the line when they launch a business hosting outrageous, anything-goes bachelor parties in Hungary.;/title/tt7027092/;5.3;189; Budapest
80156925;Movie;Christmas in the Smokies;Gary Wheeler;Sarah Lancaster, Barry Corbin, Alan Powell, Jill Wagner, Danny Vinson, Gregory Alan Williams, Rebecca Koon, Brett Rice;United States;2019-03-01;2015;TV-G;88 min;Children & Family Movies, Dramas, Romantic Movies;In the Smoky Mountains, an ambitious woman works to save her family's historic berry farm as her ex, a country music star, returns to town.;/title/tt4923846/;5.9;1071; Christmas in the Smokies
80222770;TV Show;Cricket Fever: Mumbai Indians;;;India;2019-03-01;2019;TV-MA;1 Season;Docuseries, International TV Shows;Follow Indian Premier League champions Mumbai Indians through the 2018 season in this series featuring insider insights and intense cricket action.;/title/tt8531592/;7.2;349; Cricket Fever: Mumbai Indians
60002907;Movie;Crouching Tiger, Hidden Dragon;Ang Lee;Chow Yun Fat, Michelle Yeoh, Zhang Ziyi, Chang Chen, Lung Hsiung, Cheng Pei-pei, Fa Zeng Li, Xian Gao, Yan Hai, De Ming Wang;Taiwan, Hong Kong, United States, China;2019-03-01;2000;PG-13;120 min;Action & Adventure, International Movies, Romantic Movies;A young woman in ancient China longs for an adventurous life rather than a dull arranged marriage in Ang Lee's Oscar-winning martial arts epic.;/title/tt0190332/;7.8;244569; Crouching Tiger, Hidden Dragon
80001101;TV Show;Doomsday Preppers;;Michael Izquierdo;United States;2019-03-01;2013;TV-14;1 Season;Reality TV, Science & Nature TV;This series highlights a diverse group of survivalists as they prepare for various catastrophic scenarios that could cause civilization to collapse.;/title/tt2069270/;6.1;832; Doomsday Preppers
80990534;Movie;Haunting on Fraternity Row;Brant Sersen;Jacob Artist, Jayson Blair, Shanley Caswell, Claudia Lee, Ashton Moio, Cameron Moulene, Molly Tarlov, Chester Rushing;United States;2019-03-01;2018;TV-MA;99 min;Horror Movies, Independent Movies;When a fraternity's last big luau serves up horrible deaths to its partygoers, the brothers learn firsthand about their house’s frightening history.;/title/tt6089358/;3.8;701; Haunting on Fraternity Row
70111265;Movie;Hulk Vs.;Sam Liu, Frank Paur;Fred Tatasciore, Matthew Wolf, Graham McTavish, Grey DeLisle, Kari Wahlgren, Bryce Johnson, Janyse Jaud, Jay Brazeau, Jonathan Holmes, Paul Dobson, Michael Adamthwaite, French Tickner, Nicole Oliver, Qayam Devji, Steve Blum, Mark Acheson, Colin Murdock, Nolan North, Tom Kane;United States;2019-03-01;2009;PG-13;83 min;Action & Adventure, Sci-Fi & Fantasy;This action-packed animated double feature pits the Hulk against two of the Marvel Universe's most powerful characters: Wolverine and Thor.;/title/tt1325753/;7.1;10983; Hulk Vs.
80071907;Movie;Kilo Two Bravo;Paul Katis;David Elliot, Mark Stanley, Scott Kyle, Benjamin O'Mahony, Bryan Parry, Liam Ainsworth, Andy Gibbins, John Doughty, Paul Luebke, Thomas Davison, Grant Kilburn, Robert Mitchell, Jon-Paul Bell, Malachi Kirby, Ali Cook;United Kingdom;2019-03-01;2014;R;109 min;Dramas, Independent Movies, Thrillers;On patrol in Afghanistan, a British paratrooper unit unwittingly ventures into a dry riverbed that turns out to be littered with land mines.;/title/tt3622120/;7.1;10571; Kilo Two Bravo
70020730;Movie;Layer Cake;Matthew Vaughn;Daniel Craig, Colm Meaney, Kenneth Cranham, Sienna Miller, Tom Hardy, Michael Gambon, George Harris, Jamie Foreman, Marcel Iures, Ben Whishaw, Tamer Hassan;United Kingdom;2019-03-01;2004;R;105 min;Independent Movies, International Movies, Thrillers;A seasoned British drug dealer longs to ditch his illegal trade. But he can't do that without wrapping up just one more job.;/title/tt0375912/;7.3;158574; Layer Cake
80202258;TV Show;Northern Rescue;;William Baldwin, Kathleen Robertson, Spencer MacPherson, Taylor Thorne, Amalia Williamson, Michelle Nolden, Peter MacNeill, Natalie Lisinska;Canada;2019-03-01;2019;TV-14;1 Season;TV Dramas;After the sudden death of his wife, search and rescue commander John West relocates with his three kids to his rural hometown of Turtle Island Bay.;/title/tt8462412/;7.1;2587; Northern Rescue
81045720;Movie;Paranormal Investigation;Franck Phelizon;Andrei Indreies, Jean-Baptiste Heuet, Jose Atuncar, Pierre Porquet, Claudine Bertin, Gabriella Jordan, Effie Rey, Catalin Morar, Antoine Rodriguez;United States, France;2019-03-01;2018;TV-MA;93 min;Horror Movies, International Movies, Thrillers;When a young man becomes possessed after playing a Ouija game, a ghost hunter investigates the evil spirit dwelling within him.;/title/tt9866700/;3.7;1179; Paranormal Investigation
70236016;Movie;Radio Rebel;Peter Howitt;Debby Ryan, Sarena Parmar, Adam DiMarco, Merritt Patterson, Nancy Robertson;United States;2019-03-01;2012;TV-G;90 min;Children & Family Movies, Comedies;Shy student Tara has a secret identity: She is smooth-talking Radio Rebel, a DJ who lends her voice to all kids, popular and unpopular alike.;/title/tt2008633/;6.0;7677; Radio Rebel
80156772;Movie;The Christmas Project;Michael Buster;Jacob Buster, Anson Bagley, Grace Hallows, Josh Reid, Cooper Daniel Johnson, Alison Akin Clark, Brian Neal Clark, Evan Clark, Caitlin E.J. Meyer, Gabe White;United States;2019-03-01;2016;TV-PG;92 min;Children & Family Movies, Comedies;Four brothers prepare for war when they're forced to deliver secret holiday gifts to the school bullies. But they soon learn kindness goes a long way.;/title/tt5271120/;5.4;332; The Christmas Project
70077556;Movie;The Spiderwick Chronicles;Mark Waters;Freddie Highmore, Mary-Louise Parker, Sarah Bolger, Joan Plowright, David Strathairn, Nick Nolte, Seth Rogen, Andrew McCarthy, Martin Short;United States;2019-03-01;2008;PG;97 min;Children & Family Movies;When city-raised twins move to a tumbledown country mansion, it's quite an adjustment – especially after they uncover a magical fantasy world.;/title/tt0416236/;6.5;84134; The Spiderwick Chronicles
60021299;Movie;Wet Hot American Summer;David Wain;Janeane Garofalo, David Hyde Pierce, Michael Showalter, Marguerite Moreau, Michael Ian Black, Zak Orth, A.D. Miles, Paul Rudd, Christopher Meloni, Molly Shannon, Ken Marino, Joe Lo Truglio, Amy Poehler, Bradley Cooper, Gideon Jacobs, Elizabeth Banks;United States;2019-03-01;2001;R;98 min;Comedies, Cult Movies, Independent Movies;"Everyone wants a final shot at action on the last day at Camp Firewood, in this campy 1980s summer-camp spoof from the creators of The State.""""""""";/title/tt0243655/;6.6;51714; Wet Hot American Summer
60021299;Movie;Wet Hot American Summer;David Wain;Janeane Garofalo, David Hyde Pierce, Michael Showalter, Marguerite Moreau, Michael Ian Black, Zak Orth, A.D. Miles, Paul Rudd, Christopher Meloni, Molly Shannon, Ken Marino, Joe Lo Truglio, Amy Poehler, Bradley Cooper, Gideon Jacobs, Elizabeth Banks;United States;2019-03-01;2001;R;98 min;Comedies, Cult Movies, Independent Movies;"Everyone wants a final shot at action on the last day at Camp Firewood, in this campy 1980s summer-camp spoof from the creators of The State.""""""""";/title/tt0243655/;6.6;51714; Wet Hot American Summer
70129374;Movie;Winter's Bone;Debra Granik;Jennifer Lawrence, John Hawkes, Kevin Breznahan, Dale Dickey, Garret Dillahunt, Sheryl Lee, Lauren Sweetser, Tate Taylor;United States;2019-03-01;2010;R;100 min;Dramas, Independent Movies;In this unflinching noir drama, a resilient teen goes on the trail of her missing, drug-dealing father when his absence threatens the family's safety.;/title/tt1399683/;7.2;130567; Winter's Bone
80215076;TV Show;21 Thunder;;Stephanie Bennett, Emmanuel Kabongo, RJ Fetherstonhaugh, Andres Joseph, Kevin Claydon, Conrad Pla, Clark Backo, Ryan Pierce, Eileen Li, Susan Bain, Cristina Rosato, Jonathan Kim, Colm Feore;Canada;2018-03-01;2017;TV-MA;1 Season;Crime TV Shows, International TV Shows, TV Dramas;Players and coaches for a Montreal soccer team chase dreams of stardom while their personal lives erupt with love, fear, passion and violence.;/title/tt6145878/;6.2;863; 21 Thunder
80184973;Movie;2307: Winter's Dream;Joey Curtis;Paul Sidhu, Arielle Holmes, Branden Coles, Kelcey Watson, Anne-Solenne Hatte, Brad Potts, Timothy Lee DePriest, Fernando Argosino, Duchess Dukes, Harwood Gordon, Stormi Henley;United States;2018-03-01;2016;TV-MA;101 min;Action & Adventure, Independent Movies, Sci-Fi & Fantasy;In the frozen tundra of a futuristic Arizona where humans have been forced underground, a soldier hunts the bioengineered leader of a rebellion.;/title/tt4261326/;3.8;1426; 2307: Winter's Dream
80203919;Movie;Adel Karam: Live from Beirut;;Adel Karam;United States;2018-03-01;2018;TV-MA;59 min;Stand-Up Comedy;From Casino du Liban, Lebanese actor and comedian Adel Karam delivers earthy punchlines on kissing norms, colonoscopies and a porn star named Rocco.;/title/tt8081748/;5.3;116; Adel Karam: Live from Beirut
70229921;Movie;Ai Weiwei: Never Sorry;Alison Klayman;Ai Weiwei, Lao Ai;United States;2018-03-01;2012;R;91 min;Documentaries;Chinese artist and activist Ai Weiwei uses social media and art to inspire protests and suffers government persecution for his actions.;/title/tt1845773/;7.6;4041; Ai Weiwei: Never Sorry
70021551;Movie;Aitraaz;Abbas Alibhai Burmawalla, Mastan Alibhai Burmawalla;Akshay Kumar, Kareena Kapoor, Priyanka Chopra, Amrish Puri, Paresh Rawal, Annu Kapoor;India;2018-03-01;2004;TV-14;153 min;International Movies, Music & Musicals, Romantic Movies;A happily married business executive is forced to deal with an episode from his past that he had long thought was put behind him.;/title/tt0418460/;6.6;9102; Aitraaz
80175151;Movie;Balu Mahi;Haissam Hussain;Osman Khalid Butt, Ainy Jaffri, Sadaf Kanwal, Khurram Patras, Ali Sheikh, Zeeshan Ali, Durdana Butt, Shafqat Cheema, Adeel Hashmi, Javed Sheikh;Pakistan;2018-03-01;2017;TV-14;149 min;International Movies, Romantic Movies;Determined to stop his ex-girlfriend from marrying, a young man crashes the wrong wedding and meets a bride looking to run away.;/title/tt5370442/;6.4;516; Balu Mahi
80232404;Movie;Battle Drone;Mitch Gould;Louis Mandylor, Daniel Southworth, Richard Alan Reid, Oleg Taktarov, Natassia Malthe, Jason Earles, Dominique Swain, Michael Paré;United States;2018-03-01;2018;TV-MA;94 min;Action & Adventure, Independent Movies, Sci-Fi & Fantasy;A team of mercenaries working with the CIA accepts an off-the-books mission in Chernobyl, where deadly human-controlled droids prepare an ambush.;/title/tt2936390/;5.7;2086; Battle Drone
80219180;TV Show;Darr Sabko Lagta Hai;;Bipasha Basu;India;2018-03-01;2015;TV-MA;1 Season;International TV Shows, TV Horror, TV Thrillers;In this chilling horror anthology series, actress and model Bipasha Basu meets people who have had disconcerting paranormal experiences.;/title/tt5680206/;6.0;44; Darr Sabko Lagta Hai
80214584;Movie;Deathgrip;Clay Porter;Brendan Fairclough, Olly Wilkins, Kyle Jameson, Andrew Neethling, Nico Vink, Ryan Howard, Sam Hill, Josh Bryceland, Brandon Semenuk;United Kingdom;2018-03-01;2017;TV-MA;53 min;International Movies, Sports Movies;Mountain bikers – including legend Brendan Fairclough – put their skills to the test and engage in daring feats set against vivid backdrops.;/title/tt7046112/;6.2;117; Deathgrip
60036617;Movie;Dum;Eeshwar Nivas;Vivek Oberoi, Diya Mirza, Atul Kulkarni, Govind Namdeo, Mukesh Rishi, Sushant Singh, Yashpal Sharma, Sheeba;India;2018-03-01;2003;TV-14;162 min;Action & Adventure, Dramas, International Movies;When one of his colleagues becomes corrupted by power and goes over to the dark side, a young police officer tries to bring the offender to justice.;/title/tt0314006/;5.6;1483; Dum
70294790;Movie;Grand Masti;Indra Kumar;Riteish Deshmukh, Vivek Oberoi, Aftab Shivdasani, Suresh Menon, Manjari Fadnis, Sonalee Kulkarni, Karishma Tanna, Kainaat Arora, Bruna Abdullah, Maryam Zakaria, Pradeep Singh Rawat;India;2018-03-01;2013;TV-MA;93 min;Comedies, International Movies, Music & Musicals;Leaving their wives at home, three randy friends look forward to some raunchy extramarital fun at their college reunion.;/title/tt2476154/;4.3;5461; Grand Masti
60003401;Movie;Hamara Dil Aapke Paas Hai;Satish Kaushik;Anil Kapoor, Aishwarya Rai Bachchan, Sonali Bendre, Puru Rajkumar, Anupam Kher, Satish Kaushik, Mukesh Rishi, Jaspal Bhatti, Razak Khan, Himani Shivpuri, Smita Jaykar, Tanaaz Currim Irani;India;2018-03-01;2000;TV-14;158 min;Dramas, International Movies, Music & Musicals;Love blooms when kind-hearted Avinash takes in Preeti, a woman shunned by society, but the unorthodox living situation creates quite a stir among the neighbors.;/title/tt0255212/;5.6;1665; Hamara Dil Aapke Paas Hai
80224605;Movie;Hans Zimmer: Live in Prague;Tim Van Someren;Hans Zimmer;United Kingdom;2018-03-01;2017;TV-G;138 min;International Movies, Music & Musicals;In this concert film, Oscar-winning composer Hans Zimmer performs his most iconic movie scores to a sell-out crowd at the O2 Arena in Prague.;/title/tt5732482/;9.1;2064; Hans Zimmer: Live in Prague
70021253;Movie;Haseena Maan Jaayegi;David Dhawan;Sanjay Dutt, Govinda, Karisma Kapoor, Pooja Batra, Kader Khan, Paresh Rawal, Satish Kaushik, Aruna Irani, Anupam Kher, Ashish Vidyarthi, Aashif Sheikh, Asrani, Razak Khan, Shakti Kapoor, Bindu, Mahavir Shah, Mohan Joshi, Anil Dhawan;India;2018-03-01;1999;TV-PG;151 min;Action & Adventure, Comedies, Dramas;A millionaire opens the door to comic complications when he punishes his spoiled sons for trying to make money through shady, get-rich-quick schemes.;/title/tt0267548/;6.2;2591; Haseena Maan Jaayegi
80188099;Movie;Inconceivable;Jonathan Baker;Gina Gershon, Faye Dunaway, Nicolas Cage, Nicky Whelan, Natalie Eva Marie, Jonathan Baker, James Van Patten;United Kingdom, United States;2018-03-01;2017;R;106 min;Thrillers;A couple trying to conceive invite a woman with a mysterious past to move in with them. But it's an invitation they might come to regret.;/title/tt3481634/;5.2;7437; Inconceivable
80223227;Movie;Ishqedarriyaan;V. K. Prakash;Suhasini Mulay, Kavin Dave, Evelyn Sharma;India;2018-03-01;2015;TV-14;130 min;Dramas, International Movies, Romantic Movies;A young millionaire is willing to do anything to make the schoolteacher he loves happy. Even if it means helping her marry someone else.;/title/tt4610308/;4.9;135; Ishqedarriyaan
80223195;Movie;Issaq;Manish Tiwary;Prateik, Amyra Dastur, Ravi Kishan, Prashant Narayanan, Rajeshwari Sachdev, Neena Gupta, Makarand Deshpande, Vineet Kumar Singh, Amit Sial, Prashantt Guptha, Sudhir Pandey, Evelyn Sharma, Sandeep Bose;India;2018-03-01;2013;TV-MA;140 min;Dramas, International Movies, Music & Musicals;Two young lovers in Banaras are caught in the crossfire of a feud between their powerful families and a political climate destroying their city.;/title/tt2215163/;4.5;419; Issaq
80238297;Movie;Kaakan;Kranti Redkar;Jitendra Joshi, Urmila Kanitkar, Ashutosh Gaikwad, Ashok Shinde, Madhavi Juvekar;India;2018-03-01;2015;TV-14;132 min;Dramas, International Movies, Romantic Movies;Star-crossed lovers from different social strata struggle to overcome differences in class and family expectation, as well as a long separation.;/title/tt4602608/;8.2;36; Kaakan
80238296;Movie;Kanika;;Sharad Ponkshe, Smita Shewale;India;2018-03-01;2017;TV-14;110 min;Horror Movies, International Movies, Thrillers;A doctor and his colleagues who use sex-determination testing for unethical ends face retribution from a supernatural victim who seeks vengeance.;/title/tt6555628/;4.7;81; Kanika
80184131;Movie;LA 92;Daniel Lindsay, T.J. Martin;;United States;2018-03-01;2017;R;114 min;Documentaries;Previously unseen footage is shaped into a fresh and timely retelling of the 1992 Rodney King trial – and the verdict that sparked civil unrest.;/title/tt6794424/;8.2;2904; LA 92
80106947;Movie;Laal Rang;Syed Ahmad Afzal;Randeep Hooda, Piaa Bajpai, Jaihind Kumar, Akshay Oberoi, Rajneesh Duggal, Ashutosh Kaushik, Meenakshi Dixit, Shreya Narayan, Rajendra Sethi;India;2018-03-01;2016;TV-14;143 min;Dramas, International Movies, Thrillers;Eager for cash, Rajesh joins his friend Shankar's blood-theft operation. As Rajesh's greed grows and the cops close in, Shankar is poised to explode.;/title/tt5600714/;8.0;3804; Laal Rang
80235325;TV Show;Mahi Way;;Pushtii Shakti, Viraf Patel, Siddhant Karnick, Monica Khanna, Amrita Raichand, Suparna Marwah, Mark Farokh Parekh;India;2018-03-01;2010;TV-14;1 Season;International TV Shows, TV Comedies;Though worried she's doomed to be single forever, Mahi embraces her vivacious and creative nature while working to tame her inner critic.;/title/tt1595198/;7.9;182; Mahi Way
80223230;Movie;No Entry;Anees Bazmee;Anil Kapoor, Salman Khan, Fardeen Khan, Bipasha Basu, Lara Dutta, Esha Deol, Celina Jaitly, Boman Irani;India;2018-03-01;2005;TV-PG;161 min;Comedies, International Movies;After a prank goes sideways, three buddies find their relationships  – with women and each other – tested in unexpected ways.;/title/tt0451833/;6.6;9928; No Entry
80059049;Movie;Pardes;Subhash Ghai;Shah Rukh Khan, Amrish Puri, Mahima Chaudhry, Apoorva Agnihotri, Alok Nath, Himani Shivpuri, Padmavati Rao, Madhuri Bhatia, Dina Pathak, Benu Kalsi, Anand Balraj, Ajay Nagrath, Deepak Qazir, Shashi Sharma, Smita Jaykar, Pavan Malhotra, Aditya Narayan, Subhash Ghai;India;2018-03-01;1997;TV-14;187 min;Dramas, International Movies, Romantic Movies;Prompted by loyalty, Arjun plays matchmaker between his philandering foster brother and a conservative girl but winds up falling in love himself.;/title/tt0119861/;7.0;12974; Pardes
60032008;Movie;Pitaah;Mahesh Manjrekar;Sanjay Dutt, Nandita Das, Om Puri, Jackie Shroff, Mita Vashisht, Sachin Khedekar, Anjan Srivastav, Dinesh Anand, Mink Singh, Siddharth;India;2018-03-01;2002;TV-MA;127 min;Dramas, International Movies, Music & Musicals;Thakur Avadh is an evil landlord in a remote village who rules with an iron fist. His two sons live a debauched life, knowing that their father will bail them out of any scrape.;/title/tt0305455/;6.4;653; Pitaah
60037397;Movie;Pukar;Rajkumar Santoshi;Anil Kapoor, Madhuri Dixit, Namrata Shirodkar, Danny Denzongpa, Om Puri, Kulbhushan Kharbanda, Farida Jalal, Shivaji Satham;India;2018-03-01;2000;TV-14;165 min;Action & Adventure, Dramas, International Movies;A notorious terrorist manipulates an Indian army major's jilted lover into helping him obtain a classified military code.;/title/tt0218533/;6.8;2082; Pukar
80223228;Movie;Rahasya;Manish Gupta;Kay Kay Menon, Ashish Vidyarthi, Tisca Chopra, Mita Vashisht, Bikramjeet Kanwarpal, Ashwini Kalsekar, Kunal Sharma, Nimai Bali;India;2018-03-01;2015;TV-14;117 min;Dramas, International Movies;The murder of a teenage girl found dead in her bedroom opens up a twisted investigation that leads into a dark, murky labyrinth of secrets and lies.;/title/tt3337550/;7.6;4084; Rahasya
70099702;Movie;Shaurya: It Takes Courage to Make Right... Right;Samar Khan;Rahul Bose, Javed Jaffrey, Minissha Lamba, Seema Biswas, Deepak Dobriyal, Kay Kay Menon, Amrita Rao, Rosa Catalano, Subrat Dutta, Priyesh Kaushik;India;2018-03-01;2008;TV-14;135 min;Dramas, International Movies;Courtroom intrigue plays out against a backdrop of military secrets in this Bollywood drama with a plot that's reminiscent of A Few Good Men.;/title/tt1101665/;7.3;3471; Shaurya: It Takes Courage to Make Right... Right
80238637;Movie;Shubh Aarambh;Amit Barot;Harsh Chhaya, Prachi Shah, Bharat Chawda, Deeksha Joshi, Aarjav Trivedi, Prashant Barot, Harsha Bhavsar;India;2018-03-01;2017;TV-PG;127 min;Dramas, International Movies, Romantic Movies;As her own wedding looms on the horizon, a marriage counselor strives to save her future in-laws' crumbling relationship.;/title/tt6949882/;7.3;82; Shubh Aarambh
80188777;Movie;Shuddhi;Adarsh Eshwarappa;Lauren Spartano, Niveditha, Amrutha Karagada, Shashank Purushotham, Sidhartha Maadhyamika, Ajay Raj, Sanchari Vijay, Veena Sundar;India, United States;2018-03-01;2017;TV-14;115 min;Dramas, International Movies, Thrillers;An American woman on a revenge mission travels to India and befriends two journalists seeking justice for violent crimes against women.;/title/tt4688446/;8.1;328; Shuddhi
80132381;Movie;Something Huge;Carlo Padial;Berto Romero, Carolina Bang, Javier Botet, Carlos Areces, Miguel Noguera, Toni Sevilla;Spain;2018-03-01;2017;TV-MA;87 min;Comedies, Independent Movies, International Movies;"A director and a comedian want to shoot the comedy of the future"""" and make cinema history""";/title/tt5674698/;4.4;380; Something Huge
80023851;Movie;Super Nani;Indra Kumar;Rekha, Randhir Kapoor, Sharman Joshi, Anupam Kher, Shweta Kumar, Varsha Usgaonkar, Rajesh Kumar, Shreya Narayan;India;2018-03-01;2014;TV-PG;127 min;Comedies, Dramas, International Movies;A loving, concerned American grandson travels to Mumbai to rescue his unappreciated grandmother from her drudgery and fulfill her true potential.;/title/tt2630076/;4.7;357; Super Nani
70019491;Movie;Swades;Ashutosh Gowariker;Shah Rukh Khan, Gayatri Joshi, Kishori Balal, Smith Seth, Lekh Tandon, Rajesh Vivek, Daya Shankar Pandey, Farrukh Jaffar;India;2018-03-01;2004;TV-PG;185 min;Dramas, International Movies;An Americanized NASA scientist returns to his native India on a business trip and searches for the nanny who helped raise him.;/title/tt0367110/;8.2;77534; Swades
70304187;Movie;Swearnet Live;Mike Smith, John Paul Tremblay, Robb Wells;Mike Smith, John Paul Tremblay, Robb Wells, John Dunsworth, Pat Roach, Leigh MacInnis, Luke Gordon;Canada;2018-03-01;2014;TV-MA;75 min;Comedies, International Movies;"Trailer Park Boys"""" John Paul Tremblay""";/title/tt3599642/;4.5;422; Swearnet Live
